[
  {
    "schema_version": "cs.upstream-event/1.0",
    "event_id": "cs2-3c479667686b4fcc5609f2b4316e4a81",
    "observed_at": "2026-08-01T00:00:00Z",
    "available_at": "2026-08-01T00:00:00Z",
    "content_hash": "sha256:96bae9abd1a756e2fa6d4f49e87991720f8c64a0a6f747ec9d6141315ba19150",
    "idempotency_key": "cs-upstream-v1:878fe1887fdfbf0090f779b04d19cdd3f26c8e22052d1ea80620deb7a2422118",
    "provenance": {
      "source": "fixture",
      "source_record_id": "example-1",
      "source_uri": null,
      "collector": "fixture",
      "collector_version": "1.0"
    },
    "payload": {"team_a": "Vitality", "team_b": "MOUZ", "format": "bo3"}
  }
]
